{
  "schema": 1,
  "build": {
    "version": "1.29.163709",
    "executable": "DayZ_x64.exe",
    "sha256": "6e1719275798a69d61da4f80fa57fb5f2b8d1910c95477acf1cdc73da9af3129",
    "file_size": 17851448,
    "pe_timestamp": "0x6A72FC58",
    "image_size": "0x4406000",
    "verified": "unverified",
    "provenance": "analysis"
  },
  "symbols": {
    "camera.active_state": {
      "rva": "0x4B6BE0",
      "kind": "function",
      "check": "83 B9 88 00 00 00 FF 74 08 48 8B 81",
      "note": "Active camera state getter; checks +0x88 != -1 then reads +0x118."
    },
    "camera.fov_update": {
      "rva": "0x4B7AD0",
      "kind": "function",
      "check": "48 8B C4 48 89 58 08 48 89 68 10 48",
      "note": "Camera field of view update; hooked to override the gameplay value."
    },
    "camera.manager": {
      "rva": "0x1007CE0",
      "kind": "global",
      "note": "Camera manager pointer, passed to the active camera state getter."
    },
    "camera.profile_fov": {
      "rva": "0x1007E00",
      "kind": "global",
      "note": "Float global holding the loaded DayZProfile field of view."
    },
    "engine.singleton": {
      "rva": "0x42626D0",
      "kind": "global",
      "note": "Root engine object pointer."
    },
    "gui.hud_layout": {
      "rva": "0x8A2280",
      "kind": "function",
      "check": "40 53 48 83 EC 60 48 8B 01 48 8B D9",
      "note": "GetHudContentRect; hooked to read the HUD content rectangle."
    },
    "gui.input_handler": {
      "rva": "0x350B60",
      "kind": "function",
      "check": "40 55 56 57 41 54 41 55 41 56 41 57",
      "note": "Window message handler and WM_INPUT consumer."
    },
    "gui.inventory_preview_call": {
      "rva": "0x5C4CA9",
      "kind": "instruction",
      "check": "44 8B 0D E4 51 A4 00 45 33 FF 0F 28",
      "note": "Call site of the inventory item preview preparation."
    },
    "gui.scale": {
      "rva": "0x426F5CC",
      "kind": "global",
      "note": "Float global scaling the HUD."
    },
    "input.device_update": {
      "rva": "0x351DE0",
      "kind": "function",
      "check": "41 57 48 83 EC 40 48 89 5C 24 58 4C",
      "note": "Raw mouse device update; copies and zeroes the accumulated frame delta."
    },
    "input.has_game_focus": {
      "rva": "0x5F6900",
      "kind": "function",
      "check": "48 83 EC 28 83 B9 D4 83 01 00 00 44",
      "note": "HasGameFocus(id); false while the focus counter is zero."
    },
    "input.keyboard_poll": {
      "rva": "0x34FDF0",
      "kind": "function",
      "check": "48 89 5C 24 08 57 48 81 EC 20 01 00",
      "note": "Polled keyboard module; maps 256 virtual key slots through a table at Input+0x85D0."
    },
    "input.record_ctor": {
      "rva": "0x53A430",
      "kind": "function",
      "check": "40 53 48 83 EC 20 48 8B D9 E8 A2 A6",
      "note": "UAInput record constructor; sets the active state block and the record flags."
    },
    "input.register_raw_devices": {
      "rva": "0x34FCE0",
      "kind": "function",
      "check": "48 83 EC 38 83 B9 C0 00 00 00 00 74",
      "note": "One of the RegisterRawInputDevices call sites."
    },
    "render.dynamic_blur": {
      "rva": "0x22EF70",
      "kind": "function",
      "check": "48 8B C4 4C 89 48 20 55 48 8D 68 C8",
      "note": "Blur effect handler."
    },
    "render.dynamic_blur_parameter_index": {
      "rva": "0xFED8F8",
      "kind": "global",
      "note": "Index of the blur amount parameter, zeroed per call by the predecessor project."
    },
    "render.execute_view": {
      "rva": "0x4507A0",
      "kind": "function",
      "check": "48 89 5C 24 08 48 89 6C 24 10 48 89",
      "note": "Executes a view. Both call sites ignore the return value, so a view can be skipped for a frame."
    },
    "render.finalize_view": {
      "rva": "0x4508B0",
      "kind": "function",
      "check": "48 89 5C 24 08 57 48 83 EC 20 41 0F",
      "note": "Clears the prepared view pointer."
    },
    "render.frame": {
      "rva": "0x8E77C0",
      "kind": "function",
      "check": "44 88 44 24 18 88 54 24 10 55 56 57",
      "note": "Per-frame work in world; builds the visibility and draw lists."
    },
    "render.prepare_view": {
      "rva": "0x44F5A0",
      "kind": "function",
      "check": "48 85 D2 0F 84 9A 11 00 00 48 8B C4",
      "note": "View setup; stores the prepared view pointer into the render context."
    },
    "render.projection_dispatch": {
      "rva": "0x952000",
      "kind": "function",
      "check": "40 53 48 83 EC 20 48 8B D9 48 8B 89",
      "note": "Per-frame dispatch; refreshes the primary FrameBase and the cached view and projection matrices."
    },
    "render.world": {
      "rva": "0x8E7650",
      "kind": "function",
      "check": "48 89 6C 24 18 57 41 56 41 57 48 83",
      "note": "Executes the prepared draw lists. Scene preparation, not this, is the per-eye unit."
    },
    "script.cfgmods_read": {
      "rva": "0x43F6F2",
      "kind": "instruction",
      "check": "4C 8D 05 DF A9 82 00 48 8D 55 B0 48",
      "note": "First of four references to the CfgMods config class name in the mod setup function; a fifth is at 0x5977EB."
    },
    "script.load_script_retail_gate": {
      "rva": "0x2D9A3B",
      "kind": "instruction",
      "check": "48 8D 15 E6 A5 96 00 41 B8 01 00 00",
      "note": "Loads the refusal message inside script.load_script_stub. The only reference to that string in the image."
    },
    "script.load_script_stub": {
      "rva": "0x2D9A30",
      "kind": "function",
      "check": "48 83 EC 28 48 8B 0D F5 80 D1 00 48",
      "note": "Whole native body bound to ScriptModule.LoadScript on retail: log the refusal, return null. Registered as the static method at script.scriptmodule_registrator + 0xC4."
    },
    "script.module_config_add": {
      "rva": "0x4CA7E0",
      "kind": "function",
      "check": "4C 8B DC 49 89 53 10 55 53 56 57 41",
      "note": "Called once per CfgMods script module key with the key name in r9; the common path that turns a mod's config entry into a script module."
    },
    "script.module_config_read": {
      "rva": "0x4CA5C0",
      "kind": "function",
      "check": "C8 89 54 24 20 48 8B 15 8C 67 A5 00",
      "note": "Reads the five CfgMods script module keys in order (engine, gameLib, game, world, mission at 0x4CA5FE, 0x4CA666, 0x4CA6C9, 0x4CA728, 0x4CA787) and calls script.module_config_add for each."
    },
    "script.native_register_method": {
      "rva": "0x31B7F0",
      "kind": "function",
      "check": "48 89 74 24 10 57 48 83 EC 20 48 8B",
      "note": "Binds one instance method: (class, ctx, name, function, flags)."
    },
    "script.native_register_static": {
      "rva": "0x31B790",
      "kind": "function",
      "check": "48 89 74 24 10 57 48 83 EC 30 0F B6",
      "note": "Binds one static method; same shape as script.native_register_method."
    },
    "script.script_module_instance": {
      "rva": "0xFF1B20",
      "kind": "global",
      "note": "The engine ScriptModule the g_Script script global is bound to."
    },
    "script.scriptmodule_registrator": {
      "rva": "0x2D85FB",
      "kind": "instruction",
      "check": "48 8B 8B 30 04 00 00 4C 8D 05 17 0D",
      "note": "Registration of the ScriptModule script class and its methods: Call 0x31AAA0, CallFunction 0x31ACE0, CallFunctionParams 0x31AEF0, Release 0x2E7420, LoadScript 0x2D9A30."
    }
  },
  "offsets": {
    "camera.transform_position": {
      "value": "0x74",
      "note": "Gameplay camera position inside the camera manager."
    },
    "camera.transform_rotation": {
      "value": "0x50",
      "note": "Gameplay camera 3x3 rotation inside the camera manager, rows at +0x50, +0x5C and +0x68."
    },
    "framebase.rotation": {
      "value": "0x8",
      "note": "3x3 basis. Honoured by the renderer, so head rotation written here reaches the image."
    },
    "framebase.translation": {
      "value": "0x2C",
      "note": "Translation. Ignored by the renderer in this build; eye separation never reaches rendering."
    },
    "input.focus_counter": {
      "value": "0x183D4",
      "note": "Game focus counter; HasGameFocus is false while it is zero."
    },
    "input.keyboard_table": {
      "value": "0x85D0",
      "note": "Virtual key to slot table used by the polled keyboard module."
    },
    "input.mouse_delta_x": {
      "value": "0x89F8",
      "note": "Accumulated raw mouse delta X for the frame, relative to the Input object."
    },
    "input.mouse_delta_y": {
      "value": "0x89FC",
      "note": "Accumulated raw mouse delta Y for the frame, relative to the Input object."
    },
    "render.context_camera": {
      "value": "0x118",
      "note": "Camera pointer read by the active camera state getter, which first checks +0x88 != -1."
    },
    "uainput.active_state": {
      "value": "0x28",
      "note": "Pointer to the active state block of a UAInput record, +0x30 by default."
    },
    "uainput.control_flags": {
      "value": "0x70",
      "note": "Control flags: 0x08 locked, 0x20 from the registry byte, 0x40 force enabled."
    },
    "uainput.state_block": {
      "value": "0x30",
      "note": "State block A, 0x20 bytes; +0x34 holds the press, release and hold flags."
    }
  }
}
